{
  "metadata": {
    "org_id": "ORG-HC-001",
    "last_updated": "2026-05-06T00:00:00Z"
  },
  "organizational_context": {
    "industry_sector": "Healthcare",
    "geographic_location": ["South Australia"]
  },
  "technology_stack": {
    "inventory_type": "CPE_List",
    "assets": [
      { "asset_name": "Epic EHR System", "cpe": "cpe:2.3:a:epic:epiccare:-:*:*:*:*:*:*:*", "criticality": 5 },
      { "asset_name": "Philips Patient Monitoring", "cpe": "cpe:2.3:h:philips:intellivue_mx800:-:*:*:*:*:*:*:*", "criticality": 5 },
      { "asset_name": "Microsoft Windows 10", "cpe": "cpe:2.3:o:microsoft:windows_10:-:*:*:*:*:*:*:*", "criticality": 3 },
      { "asset_name": "Cisco Network Switch", "cpe": "cpe:2.3:h:cisco:catalyst_9300:-:*:*:*:*:*:*:*", "criticality": 4 }
    ]
  },
  "risk_profile": {
    "critical_assets": [
      "Patient Health Records",
      "Medical Imaging Systems",
      "ICU Monitoring Network",
      "Electronic Health Records",
      "Clinical Workstations"
    ],
    "threat_landscape": [
      "T1486 - Data Encrypted for Impact",
      "T1566 - Phishing",
      "T1078 - Valid Accounts",
      "T1190 - Exploit Public-Facing Application",
      "T1003 - Credential Dumping",
      "Black Vine",
      "Orangeworm",
      "ransomware",
      "medical data theft",
      "healthcare phishing"
    ]
  }
}
