{
  "metadata": {
    "org_id": "ORG-EN-002",
    "last_updated": "2026-05-06T00:00:00Z"
  },
  "organizational_context": {
    "industry_sector": "Energy",
    "geographic_location": ["Victoria", "New South Wales"]
  },
  "technology_stack": {
    "inventory_type": "CPE_List",
    "assets": [
      { "asset_name": "GE Grid Solutions EMS", "cpe": "cpe:2.3:a:ge:energy_management_system:6.0:*:*:*:*:*:*:*", "criticality": 5 },
      { "asset_name": "OSIsoft PI Historian", "cpe": "cpe:2.3:a:osisoft:pi_data_archive:2018:*:*:*:*:*:*:*", "criticality": 4 },
      { "asset_name": "Cisco Industrial Switch", "cpe": "cpe:2.3:h:cisco:ie-4000:-:*:*:*:*:*:*:*", "criticality": 3 }
    ]
  },
  "risk_profile": {
    "critical_assets": [
      "Distribution Control Systems",
      "Outage Management System",
      "Customer Billing Data",
      "Energy Management System",
      "Industrial Control Network"
    ],
    "threat_landscape": [
      "T1078 - Valid Accounts",
      "T1486 - Data Encrypted for Impact",
      "T1566 - Phishing",
      "T1190 - Exploit Public-Facing Application",
      "T1046 - Network Service Discovery",
      "Turla",
      "APT28",
      "APT33",
      "ICS malware",
      "SCADA compromise",
      "ransomware"
    ]
  }
}
